Fecha;Hora;META;SUBMETA;Consultor;targets;layer;Nombre Archivo;Carpeta;Path;Descripcion;Pendiente
10-abr;9:05;Pesca Artesanal;;Geovagi Flores;AO;ao_access;desembarques pesca artesanal.xls;INFORMACION;Google Drive\INDICE DE SALUD DEL OCEANO GG\INFORMACION\02 Pesca Artesanal;Informacion de desembarque para la capa ao access;
10-abr;11:09;METODOLOGiA;;Soraya Abad;;;3_Guia_conceptual_del_Indice_de_la_Salud_del_Oceano_-_Filosofia_y_MarcoNov19;METODOLOGIA;Google Drive\INDICE DE SALUD DEL OCEANO GG\METODOLOGIA;guia conceptual en castellano del ISOGG;
10-abr;11:09;METODOLOGIA;;Soraya Abad;;;ptoRefPescaArtesanalRegionales;Punto de Referencia;Google Drive\INDICE DE SALUD DEL OCEANO GG\Punto de Referencia\02 Pesca Artesanal;discusion de como establecieron los puntos de referencia para la pesca artesanal en los estudios regionales de Brasil y la Costa Oeste de los EE.UU.;
14-abr;11:02;BIODIVERSIDAD;;Jimmy Martillo;HAB;hab_extent;TiposdeFondos.xls;INFORMACION;Google Drive\INDICE DE SALUD DEL OCEANO GG\INFORMACION\10 Biodiversidad;extension de los tipos de fondos por region;
14-abr;11:16;BIODIVERSIDAD;;Fernando Rivera;SPP;;SPP UICN V1;INFORMACION;Google Drive\INDICE DE SALUD DEL OCEANO GG\INFORMACION\10 Biodiversidad;Tabla con especies en el GG, tendencia, categoria UICN, y tipo de habitat;
14-abr;14:32;Pesca Artesanal;;Geovagi Flores;AO;capa SAO;Base Desembarques pesca artesanal;INFORMACION;Google Drive\INDICE DE SALUD DEL OCEANO GG\INFORMACION\02 Pesca Artesanal;;CELDAS RESALTADAS EN AMARILLO, CONFIMAR SI  la fórmula planteada por Lelys puede correrse con promedios anuales por grupos de especie
14-abr;;Proteccion Costera;;Jimmy Martillo;HAB;hab_health;proteccion costera 69-99-06.xlsx;;Google Drive\INDICE DE SALUD DEL OCEANO GG\INFORMACION\05 Proteccion Costera;Unicos datos disponibles digitales de extension de manglar 1km costa adentro, 1km costa afuera;
;;Provision de Alimentos;Pesquerias;Yahira Piedrahita, David Chicaiza;FIS;fis_b_bmsy;Matriz conjugada datos pesqueros,xlsx;INFORMACION;Google Drive\INDICE DE SALUD DEL OCEANO GG\INFORMACION\01 Provision de Alimentos\Documentos ISO GG- Provision de Alimentos\Catch data for each Taxon;COMPLETO PARA PPP y camarOn pomada -(PPG, peces demersales, atunes, dorado de captura artesanal) Campos:  Familia, Genero, especie,  año, captura total (t), resiliencia, puerto de desembarque, zona de pesca y arte de pesca;Calculo MSY
;;Provision de Alimentos;Pesquerias;Yahira Piedrahita, David Chicaiza;FIS;fis_meancatch;Matriz conjugada datos pesqueros,xlsx;INFORMACION;Google Drive\INDICE DE SALUD DEL OCEANO GG\INFORMACION\01 Provision de Alimentos\Documentos ISO GG- Provision de Alimentos\Catch data for each Taxon;COMPLETO PARA PPP y camarOn pomada -(PPG, peces demersales, atunes, dorado de captura artesanal) Campos:  Familia, Genero, especie,  año, captura total (t), resiliencia, puerto de desembarque, zona de pesca y arte de pesca;Verificar region FAO (fao_saupid), taxon_id, value(metric ton)
;;Provision de Alimentos;Pesquerias;;FIS;fis_proparea_saup2rgn;mapas 2.docx;INFORMACION;Google Drive\INDICE DE SALUD DEL OCEANO GG\INFORMACION\01 Provision de Alimentos\Documentos ISO GG- Provision de Alimentos (1)\Area of each saup;Mapas de distribución y abundancia de PPP.;ver regiones de SAUP, y proporcion de area para cada region
;;Provision de Alimentos;Maricultura;Yahira Piedrahita, David Chicaiza, Tito Rodriguez;MAR;mar_coastalpopn_inland25km;Distribución camaroneras por parroquia.xlsx;INFORMACION;Google Drive\INDICE DE SALUD DEL OCEANO GG\INFORMACION\01 Provision de Alimentos\Documentos ISO GG- Provision de Alimentos (1)\Coastal population inland 25 kilometers;;
;;Provision de Alimentos;Maricultura;Roberto Saenz;MAR;mar_coastalpopn_inland25km;Población Parroquias Costeras OHI.xlsx;INFORMACION;Google Drive\INDICE DE SALUD DEL OCEANO GG\INFORMACION;Poblacion de parroquias con frente costero año 2010;Pedir informacion años anteriores
;;Provision de Alimentos;Maricultura;Yahira Piedrahita;MAR;mar_harvest_tonnes, mar_trend_years;produccion camaron.xlsx;INFORMACION;Google Drive\INDICE DE SALUD DEL OCEANO GG\INFORMACION\01 Provision de Alimentos\Documentos ISO GG- Provision de Alimentos (1)\Mariculture harvest;Datos de exportación de camarón  de la Cámara Nacional de Acuacultura. Producción ajustada de acuerdo a criterios definidos.;Diferenciar por provincias
;;Provision de Alimentos;Maricultura;Yahira Piedrahita;MAR;mar_harvest_tonnes,mar_trend_years;produccion tilapia.xlsx;INFORMACION;Google Drive\INDICE DE SALUD DEL OCEANO GG\INFORMACION\01 Provision de Alimentos\Documentos ISO GG- Provision de Alimentos (1)\Mariculture harvest;Datos de exportación de tilapia  de la Cámara Nacional de Acuacultura. Producción ajustada de acuerdo a criterios definidos.;Diferenciar por provincias
;;Provision de Alimentos;Maricultura;;MAR;mar_harvest_species;mar_haverst_species_gye2015;INFORMACION;Google Drive\INDICE DE SALUD DEL OCEANO GG\INFORMACION\01 Provision de Alimentos\Documentos ISO GG- Provision de Alimentos (1)\Mariculture species harvested;capa de datos con codigo de la especies, solo se utiliza camaron y tilapa. El codigo de tilapia es un numero nuevo que no se encuentra la capa de datos global. El codigo de camaron es uno tomado de la capa global;verificar si los codigos estan correctos
;;Provision de Alimentos;Maricultura;;MAR;mar_sustainability_score;;;;;
;;Pesca Artesanal;;Geovagi Flores;AO;ao_access;Base Desembarques pesca artesanal.xlsx;INFORMACION;Google Drive\INDICE DE SALUD DEL OCEANO GG\INFORMACION\02 Pesca Artesanal;Desembarques de Pesca Artesanal del 2006-2013 de PPG, Demersales, atun, tiburones, rayas, camaron;datos de desembarque para ciertos años, estan resaltados en el documento
;;Pesca Artesanal;;Geovagi Flores;AO;ao_need;ao_need_gye2015_GF.xlsx;INFORMACION;Google Drive\INDICE DE SALUD DEL OCEANO GG\INFORMACION\02 Pesca Artesanal;Pobreza por Necesidades Basicas Insatisfechas 1990-2001-2010;cambiar id de Santa Elena a 6
;;Almacenamiento de Carbono;;Jimmy Martillo;HAB;hab_extent;hab_extent_gye2015_TG;INFORMACION;Google Drive\INDICE DE SALUD DEL OCEANO GG\INFORMACION\CSV\04 Almacenamiento de Carbono;extension del manglar en km2;COMPLETO
;;Almacenamiento de Carbono;;Jimmy Martillo;CS;cs_habitat_extent;cs_habitat_extent_gye2015_TG;INFORMACION;Google Drive\INDICE DE SALUD DEL OCEANO GG\INFORMACION\04 Almacenamiento de Carbono;;
;;;;;;;;;;;
